{
	"$schema": "../../../../schemas/release.schema.json",
	"releaseDate": "2026-10-23",
	"channel": "stable",
	"requirements": {
		"wordpress": { "min": "6.4" },
		"php": { "min": "8.1" }
	},
	"download": {
		"asset": "kafra-datablad-v1.0.0.zip"
	},
	"changelog": {
		"added": ["Første stabile versjon."]
	}
}
